{
  "schema": "https://identity-atoms.com/schemas/composition-v1.json",
  "type": "identity",
  "id": "security-architect",
  "version": "1.0.0",
  "name": "Security Architect",
  "description": "Security architect identity with elevated access for security review, threat modeling, and audit operations. Requires signed identity claim.",
  "tags": ["security", "architect", "elevated", "olympus"],
  "references": {
    "trust_framework": {
      "ref": "identity-atoms://atoms/trust-framework/convergent-systems-co",
      "version": "1.0.0"
    },
    "auth_methods": [
      {
        "ref": "identity-atoms://atoms/auth-method/github-oauth",
        "version": "1.0.0"
      }
    ],
    "claim_types": [
      {
        "ref": "identity-atoms://atoms/claim-type/github-org-membership",
        "version": "1.0.0"
      }
    ]
  }
}
