{
  "schema": "https://identity-atoms.com/schemas/composition-v1.json",
  "type": "identity",
  "id": "operator",
  "version": "1.0.0",
  "name": "Operator",
  "description": "Human operator identity. Authenticated via GitHub OAuth with organization membership claim. Grants standard operator access to Olympus capabilities.",
  "tags": ["operator", "human", "authenticated", "olympus"],
  "references": {
    "trust_framework": {
      "ref": "identity-atoms://atoms/trust-framework/convergent-systems-co",
      "version": "1.0.0"
    },
    "auth_methods": [
      {
        "ref": "identity-atoms://atoms/auth-method/github-oauth",
        "version": "1.0.0"
      }
    ],
    "claim_types": [
      {
        "ref": "identity-atoms://atoms/claim-type/github-org-membership",
        "version": "1.0.0"
      }
    ]
  }
}
