{
  "schema": "https://identity-atoms.com/schemas/composition-v1.json",
  "type": "identity",
  "id": "none",
  "version": "1.0.0",
  "name": "None",
  "description": "Anonymous/unauthenticated identity. No credential required. Binds to the minimal policy floor only.",
  "tags": ["none", "anonymous", "unauthenticated", "olympus"],
  "references": {
    "trust_framework": {
      "ref": "identity-atoms://atoms/trust-framework/convergent-systems-co",
      "version": "1.0.0"
    }
  }
}
