{
  "schema": "https://identity-atoms.com/schemas/composition-v1.json",
  "type": "identity",
  "id": "sre",
  "version": "1.0.0",
  "name": "SRE",
  "description": "Site Reliability Engineer identity. Elevated access for production operations. Requires signed identity claim from the convergent-systems-co trust framework.",
  "tags": ["sre", "elevated", "production", "olympus"],
  "references": {
    "trust_framework": {
      "ref": "identity-atoms://atoms/trust-framework/convergent-systems-co",
      "version": "1.0.0"
    },
    "auth_methods": [
      {
        "ref": "identity-atoms://atoms/auth-method/github-oauth",
        "version": "1.0.0"
      }
    ],
    "claim_types": [
      {
        "ref": "identity-atoms://atoms/claim-type/github-org-membership",
        "version": "1.0.0"
      }
    ]
  }
}
